text,label
cute dumb females trash,neutral
if you aint bout that murder game pussy nigga shut up,offensive
all the hoes on loveandhiphop going to prom 128514128514128514,offensive
if having hoes excite you you still a lil nigga 128581,offensive
im done with life im just ready to wake up and have pussy for breakfast everyday,offensive
anyone who came to the us as an indentured servant is white trash,hate_speech
you a bitch edgar,offensive
that larry the cucumber tweet is funny af but its a bit much to rt you young bitches might cry128514128514128514,offensive
fuck you spear chucker,hate_speech
you a hoe for that im rolling 128514128514128514128514128514,offensive
oomf make my skin itch like ew bitch,offensive
whats with all these pussies turning themselves into yugioh cards lately,offensive
when dykes hear ladies free before 10,offensive
yes das def da problemif histeacher was a spear chucker he woulda gt both dose rite,neutral
idc how cute you are that shit dont matter if you got a trash personality,offensive
these hoes is crazy,offensive
anything to trash this black president,hate_speech
i didnt pull bitches in elementary school my parents couldnt afford the 64count color box with the sharpener on the back8230,offensive
ok wat ever u say whitey u prolly never even seen shaft,hate_speech
done that spell check we know you meant fat liberal dyke feminist nazi bitches,hate_speech
pumpkin spice marlboros for da hoes,offensive
bitch boy,offensive
watch ima hit that hoe later on this summer finna be the bestmost livestock party of 2014,offensive
im starting to not like meek this nig a lil to arrogant for me,hate_speech
stinky hoe,offensive
yoga has been around for ages and these bitches just now figuring it out,offensive
9733 best asian massage on the park slope top rated spa 9733 7186220221 24,neutral
excuse me heres your nose i found it in my business hoe,offensive
ape fuck u broke ass racist,hate_speech
crew of women hillbillies amp gangsters wthe director itsawrap 999265039127916127909,neutral
i was wearing bucket hats before you basic bitches,offensive
this hoe loud,offensive
dumb bitches,offensive
how bitches look wen they hear their song in da club,offensive
new york niggas quick to take off on a bitch in public boy lol,hate_speech
jesus walks bitch,offensive
cookies n cream oreo fudge ice cream,neutral
hide ur bitches or else,offensive
if racial minorities werent criminally inclined they wouldnt have so much to worry about act your color race traitor,hate_speech
this being single shit is really trash especially when you aint got nobody to text after midnight,offensive
someone who claims theyre a bad bitch shouldnt get offended so easily,offensive
ugly hoes be the loudest u need to duck off amp hide yourself frfr,offensive
jus wanted to let y225ll know hope the hurricane kills your soca sunday trash lordwillin,hate_speech
aye its a lot of niggas out here that cant fuck a bad bitch unless they get her drunk smh preach,offensive
i do know one thing tho bitches they come amp go,offensive
bible rt you a hoe if you already got new years eve plans,offensive
view from the ghetto aint bad rio,neutral
lol my brother a fag mann,offensive
breaking news ur a little bitch,offensive
fuck outta here and go put some more trash ass ink on your faggot ass self pussy,hate_speech
i keep these hoes in check until they bounce,offensive
or lack of 8220 smh u niggers amp ur music knowledge8221,offensive
horrible rt invader zim was trash,hate_speech
his jeans bluer denabitch dont let him lie to you hes sick rt how you know the pussy wast overrated ht8230,offensive
jennas a faggot,hate_speech
theses niggas hoes and these bitches greedy,offensive
8220 i hate that hoe already 128514128128 128514128514128514 this shit cracks me up,hate_speech
not trying to follow any spooks no offense,hate_speech
damn son maybe he didnt know it was ya piece he was just tryna get some pussy breh,offensive
if you snipe youre a fucking faggot i fucking hope all of you snipers get fucking raped and suffer from cancer,hate_speech
girls dont let a guy treat you like a yellow starburst you are a pink starburst,neutral
if you think that the term redskins being offensive is a political issue you are ignorant,neutral
its goldbar dumb bitch and no my dad wouldnt pick you up he doesnt like faggots like you 128528128076128079,hate_speech
i cant even be away from my phone that long karlie right she is a crazy bitch128533,offensive
this is retarded,hate_speech
you be totally correct anthony can8217t be livin round dem colored folk day be bringin down da hood and dem propery value,hate_speech
were a good match cuz we both retardedn weed,offensive
these hoes kno bout me,offensive
boats and hoes,offensive
karmas a bitch and so are you youll be getting along just fine real soon,hate_speech
y dont that bitch just shoot herself so sick of all those whores,hate_speech
jason admitted youre a stuck up bitch lol which you are think youre so much better than everycunt naaaaa,hate_speech
jihadi work accident seven taliban fighters including top commander killed when roadside bombs detonate prematurely8230 h8230,neutral
8220 lol this is why i dont fuck with so many bitches8221dont call her a bitch,offensive
aint wcw jus bitches i wan fck day,offensive
im sure would add this helpful parenthetical explanation if these were redneck peckerwood teabaggers,hate_speech
im partial faggothomoboth fairly describes the same sick twisted assholes out there,hate_speech
when yall got the same baby mama and realize that bitch is the real enemy,offensive
pornandroidiphoneipadsexxxx erotic erotic and wild tits and pussy fucking,offensive
hey hoe,offensive
she really asked me that dead ass serious tho all i could say was bitch wheet lol,offensive
i prefer jameis winston to not speak on tv at all damn coon,hate_speech
128527 haahaa dumb bitch,offensive
fag fuckin pirelli tire black ass nigga whit a white boy shirt on but my nigga did loosen up a lil bitbowbow,offensive
ion like doll face hoes,offensive
at the bar in downey wit my uncle this niggah faded hopefully he doesnt get us into a fight lmao,offensive
harm this pussy instead rt missing 26yrold usc medical student last seen tuesday may harm himself,hate_speech
slightlyadjusted rt alls niggers wanna do is fuck tweet and drink pineapple soda all day,hate_speech
your acting like a spoiled little faggot have fun,hate_speech
if you get offended by tweets youre a bitch,offensive
african colored car i push niggerous whips,hate_speech
howtogetagirl do not and i repeat do not refer to her as your bitch,offensive
new nashville noise loves burgers honky tonks and grabs a pizza,neutral
its 220 and me and bruno still up in this bitch lol,offensive
ugh bad bitches picture coming soon 128514,offensive
answers phone coworker theres a dead bird outside me wanna split it cw what me sorry finders keepers ri8230,neutral
amp are bitches,offensive
im referring to the second down put vick in slot play trash,neutral
u can just ask him to suck his dick not that hard white trash,offensive
if she lives at home shes a little less likely to cheat on you and be a ho,offensive
im going to blame the black man since they always blame whitey im an equal opportunity hater,hate_speech
show last night was badass thanks to everyone who came out if you didnt come out youre a retard unless you were at cock sparrer,offensive
i know bitches be mad as shit when they friends borrow their clothes amp its a bunch of girls in her ig comments sayin how cute the outfit is,offensive
i hate my manager so much she makes me wanna throw silverware at her stupid bitch ass,offensive
i would commit the rest of my gay life to being a complete 100 submissive bottom if i could be zac efrons bitch noshame gayboyproblems,offensive
i wish my parents bought me a car man people bitch about not getting what car they want when they want it and its free8230,offensive
dont be a faggot cover your mouth when you fkn cough or sneeze i got a immune system to keep strong asshole,hate_speech
omg rt fat bitch whats her,hate_speech
so i figure out why ive been a bitch lately,offensive
dumb haitian fake black faggots go to haiti and neck yourself,hate_speech
8220 im 2 much for these niggas and 3 much for these hoes 1281298221,offensive
that makes you an annoying bitch if youre out looking to be offended you cant bitch when youre offended,offensive
if california chrome doesnt go off at even money or better i might flip a trash can over i mean damn can i get 65 oh the humanity,offensive
if were dating dont be a sensitive bitch when i insult you i expect to be insulted back,offensive
if the faggots can have a page y cant theyfaggots offend me more than them,hate_speech
8220 this is awkward u fag wonder whos awesome tank that is 128522,hate_speech
if a bitch tries to get crazy tomorrow,offensive
randies are fags,hate_speech
reasonswecantbetogether if u was talkin to my nig or smashed da homies,hate_speech
quote this with your best racist comment i need them for this white bitch comin at my black side llab,offensive
u lame then a bitch get the fuck with that gay shit,offensive
niggahs watch who you fucking just to hate on your bitches,offensive
fugly queer white trash,hate_speech
youre white arent you rolls eyes rt rip to my nigga trayvon a worthless spear chucker,hate_speech
eye witness joel is a faggot,hate_speech
im a bitch but a sweetheart u feel me,offensive
8220 rt if u remember when steve from blue clues left us with that other bitch ass nigga joe,offensive
typically hateful antichristian mentally ill and ugly dyke trash pig couple jennifer mccarthy and melisa erwin,hate_speech
get some sleep pussy,offensive
whats so good about prom all i see is another faggot ass high school dance,hate_speech
lol rt youuuuu got niggas but i dont got bitches,hate_speech
your a cunt,hate_speech
ooh yea getting all hoes,offensive
yall can have skylar diggins looks like a tranny to me,offensive
im speaking on ho niggas hoe niggaz probably dont dig natural styled hair period,offensive
nicca in my dm talkn bout follow his instagram lame nicca i now no longer follow you on twitter wheretheydothatat,offensive
new york niggas quick to take off on a bitch in public boy lol,hate_speech
ankles 1281281285148220 8220 hood bitches with long weave is the worst thing ever8221 weave that be touching their ashy ankles 1285678221,hate_speech
lmao redskins turnin up,neutral
back up faggot,hate_speech
i wish hoes didnt bore mei wouldnt have this problem and would shop at hoes r us every day,offensive
tripped balls onlsd bitch,offensive
this scally lad would get it,neutral
it happens again black pack beats whitey this should make national news,hate_speech
8220 next person i see tweeting that bitch shitting on herself im unfollowing you8221,offensive
gucci mane in jail and dropping mixtapes every month and you hoes cant even text back,offensive
i dont got that bad of a mouth do i fuck shit ass bitch cunt shooby de doo wop,offensive
ay yall heard that rich gang tape thou that bitch on flame128293,offensive
bitches be swearing they pussy soooo good 128553128530 nonsense 128545,offensive
stop flattering yourself bitch the only fan you have is on your ceiling,hate_speech
81614 mo let 8220kill some crackers kill their babies new black panthers hijack his ferguson presser,hate_speech
so niggers really believe phelps just smokin on a regular huh tell me now amp ill log off for the night,hate_speech
kill this beaner,hate_speech
if they trash in yr 3 or 4 hell waive it lol,neutral
shut up bitch it ainn complete witout money melle n it,offensive
u coons cant wait to wear them oreo js,hate_speech
shut your dirty dirt trap you limp knees ashy footed blue balls isolated hamster wheel no nipples bitch,hate_speech
im such a bitch to austin 128514128514,offensive
i hate dumb bitches,hate_speech
bitch nicca talmbout a mf 3peatdf yall aint da lakers,offensive
i love my haters they my biggest fans im on the field dem bitches in the stands,offensive
bitch do i entertain you cause you always seem to be in my business,offensive
dat means get the fuck out hoe i be thinkin,offensive
fuck a bitch we never loved a thot,offensive
thinking bout those oysters at the gator bait tho128533,neutral
we some hoes bruhhh lol,offensive
why do the trashiest really ghetto girls always get the most likes and comments on insta boys up and down their pictures a8230,hate_speech
a fufu bitch cant do nun for me but break my heart or set me up,offensive
degenerateartist knows wordsgt bo jingo dangle fan slang ho ting pang lick drum swing flick alarm bicgt but you cant hear fire can you,offensive
dont message me your number and tell me to text you im not your bitch lol,offensive
ion care fuck that hoe 999665039,hate_speech
dont my nigga me honkie,hate_speech
im on that good kush and alcohol i got some down bitches but the can crawl,offensive
half the bitches that say tfti wouldnt even go i bet,offensive
did the yankees make the playoffs and properly honor jeter rt orioles win,neutral
you a pussy ass nigga and i know it nigga,hate_speech
boy 128514128514128514 rt some hoes be setting themselves up for failure shit be so funny im sleep tho 128526128526128514128514,offensive
its retarded,hate_speech
sometimes females are just fucking retarded bro i swear i just want to kick yall in the ovaries,offensive
stop being a hoe so i can love you,offensive
i dont work for pussy the code of a real man,offensive
do it pussy,offensive
some men say they8217re afraid of having daughters bc they don8217t want them to turn into 8220hoes8221 or we,offensive
im sick of his shit man sit his bitch ass im fed up bro rt geno threw yet another pick smh,offensive
my dick is called abusive cat owner because it always beats the pussy up,offensive
i just wanna slit this mf throat,hate_speech
dont judge me monkey,neutral
haha not you just getting shit from everyone else when my second favorite team is the redlegs,offensive
bitches be fallin so inlove w niggass amp then he go get a new bitch amp they try go get a new nigga to try to forget about the 8230,hate_speech
all the great qbs fold under pressure gshit if u blitz peyton ass he gon gook out,offensive
sendin the link to wishy washy to my old hoes,offensive
hahaha it makes sense hoe p,offensive
im 60 n i hate elissa a fake ass cunt,offensive
every day i thank my nigga jesus for hot wings and my uncanny ability to tend to these bitches,offensive
someone recently told me that a local yokel was going to use my twitter account to damage me so yeah,neutral
pussy watch it nuh mi neva lov mon badmon,offensive
im not sure im a broke nig 128542,offensive
nope btw yous a hoe lol,offensive
fuck your store bitch,hate_speech
a real nigga gone teach his bitch the game not run it on her 128582128130128520,hate_speech
you win some and lose some long as you get it on you aint a bitch,offensive
lmao rt rt yes amp no rt is it ok to beat a bitch up over some tweets or nah,offensive
128557128557128557128530 rt at work imma real uncle tom128584,neutral
8220 you aint special niglet rt when im chilling wit greg ppl walk up to me to ask me to take pics8221hatin,hate_speech
thats what happens when you date a colored,hate_speech
dumb ass hoe,offensive
the leftisthomosexual war on the catholic church kicked into high gear with the infiltration of the priesthood by boyraping fags,hate_speech
i wanna be someones bitch ass boyfriend right now but that just me head playin games on ya boi,offensive
im soooooo tired of this dick dyke showing up on my fb feed real studs dont fucc niggas just be bisexual,hate_speech
hoe,offensive
what you see is what you get im a guy with a love of adventure and a need for speed charlie brown,neutral
dont you mean crowd not crows,neutral
only one problem theres a no pussies allowed sorry,hate_speech
come wage with us fag,hate_speech
this rain got yall women talking out your ass a nigga should spend 80 of his income on a bitch 128514128514 bruh get these hoes the fuck outta here,hate_speech
happy birthday faggot,hate_speech
when i die on flappy bird,neutral
nevertrustabitch never trust a bitch who has a fresh copy of master p album,offensive
nope not at all but im stuck in a house full of fucking niggers help me escape 128553,hate_speech
so was slavery prohibition and not letting women to vote segregation jim crow laws etc etc i can do this all day lol,neutral
128514128514128128128128128128128128bitch you outta line,offensive
paybacks a bitch and bitch youve been livin in debt with me,offensive
if you love her then hide yo bitch so youll keep shorty,offensive
dear spoiled suburban bitch,offensive
hope yall kno wen u eat pussy u one inch away from death,offensive
yall be giving the pooest bitches so much hype stop it,offensive
rise of the planet of the apes,neutral
my best friend says i dont need to be in love right now he thinks its too soon to love monkey,neutral
finger my throbbing pussy,offensive
that was my faggot rant for the night,hate_speech
juss got this hoe free so why not lop p,offensive
am ghetto,neutral
better play your part bitch dont be a smart bitch cuz i might have a change of heart,offensive
i cant ever eat roast beef anymore without thinkin bout dark skin twat thanks a lot twitterig,offensive
the south is full of white trash the midwest is full of white trash the west coast if full of white trash,hate_speech
oh no they drafted that gay ass that come out on tv well u welcome to redskins nation no queers just a lot of niggers,hate_speech
paybacks a bitch it really is,offensive
oh i forgot we lived in the ghettohoodrats,neutral
faggot,hate_speech
i can guarantee a few things youre white youve never been anywhere near a real ghetto you or a relative is a pig 100,hate_speech
ew queer white thirsty bitch,hate_speech
she got every niggah lookin like dam,hate_speech
when it come to bitches niggas will get dirty,offensive
says the old man i hope you can survive another 10 years you silly jigga boo monkey,hate_speech
cowboys trash againthe nfl is bike to normal,neutral
like a woman to tell you what she wants you to do without sounding like a bossy demanding bitchthe art to that is sexy,offensive
8220 cute text ey bitch come over for some pizza8221,offensive
did you say spray tan charlie crist switches back to republican,neutral
of all the lazy bitches i was the laziest today noregrets,offensive
fuck bitchesget money,offensive
maple room bitch sacto style,offensive
8220 that one friend who you greet with an insult8221 niggers,hate_speech
lol ive gotten into with retards on here who actually think i am my avi ive gotten called ugly black bitch like,offensive
pls stop gassing fat hoes,offensive
i hate the ghetto trash at the special school across the street from my building all of them will grow up to be criminals,hate_speech
the question alone 128553128514128514rt what city got the most bitches with gold teeth,offensive
youre all niggers,hate_speech
yuh bitch voz de mando at ok was the best mf friday yet,offensive
i like that your room isnt a big sloppy mess like most of these twitter hoes,offensive
i like bad bitches cause they like bad bitches too 128525128525128536 hay stunna,offensive
that son of a bitch moment when youre walking around the house with socks on and step on a random wet spot,offensive
video on the record charlie baker,neutral
get some money and stop playing that old trash,neutral
breaking japanese ace masahiro tanaka will sign with the yankees for seven years 155 million via fox sports,neutral
i need to chat with where dat nicca at lol,hate_speech
sitting at the bar at work watching walking dead and all these fucking wetbacks decide to come in amp turn on their spic music jesus christ,hate_speech
my teacher always says has a man ever abused his wife while using marijuana not unless she hides the oreo cookies then she deserves it,neutral
you look like little birds help you get dressed in the morning,neutral
if you kill all cops and cracker babies what next black states white states and latino states isnt that moving backwards,hate_speech
hoes not women like to be the center of attention,offensive
youre a bitch,offensive
beat the pussy in so well her shit still hurting from a week ago 128563,offensive
ok i just wanted to know bitch at 520 if youre not here im out,offensive
stevie j turned a hoe 128111into a housewife128129128141128142 and nikko turned a housewife128582 into a hoe1281111281111281319757 i swear this shit can happen,offensive
my grandpa hooked his friend up with some pussy in vegas praise,offensive
beat ya bitch pussy up every time i see her like a bully then send her outta town wit 4 cookies,offensive
if you like after romeo chances are i think youre a faggot,hate_speech
you a pussy dawg,offensive
i wants to call bouts my vitaligro but i aint sho if you a doctor fo da colored folk,neutral
all us beaners were pissed like robert when the jew ref stopped it,hate_speech
how now gungho,neutral
128514128514128514 got dhem hoes,offensive
hell naw he aint he the star of that team lol but im sure that white honkey called him a nigga,hate_speech
colorado lawmakers consider nation8217s 1st wind energy legislation to protect birds amp bats,neutral
128514128514128514rt them 1st 48 charlotte goon niccas gon fkkk around and burn bank of america stadium down128293,hate_speech
ladies you are not a hoe if you fucked on the first night dont let these lonely bitches lie to you,offensive
i will never date a female with another niggah name on her lol wtf,offensive
to gt get past boot camp and go active a few years see what we really do daily you liberal pussy,hate_speech
the trash generation,neutral
my hoes trippin lol,offensive
thank you charlie ff,neutral
i got no pic up lines i stay on my grind i tell a bitch all the time bitch get in my car i got my 64 ridin on dayton spokes,offensive
8220 im so dead 128128128128 why you hoe me idk i just felt like flaming you lol,offensive
why you gotta phone in your avi texting but you got negative bitches,offensive
8220 i want you to be pussy whipped8221 im yours,offensive
the way i fuck her you would think i love this bitch,offensive
nigga just had them crackers on a chase,hate_speech
must have been a light skin hoe 8220 lmfao wtf she mean af 1285571285578220 he wasnt ready bruh rip,hate_speech
i was eating amp my mom gon say damn calm down tf bitch i am calm,offensive
so says the one who fills an empty hole inside herself by worshiping a royal who 4 all u kno may be a raging snotty bitch,offensive
bitch youre white stfu with your shitty spanish,hate_speech
minus all the retarded poor bots,hate_speech
i dont bend that way queer thanks for the offer its flattering,hate_speech
tell them lie speakin lips they should try pleadin 5ths more often bitch and refer to me as your awesomeness,offensive
if you like bmth adtr ptv ymas sws atl omampm aa miw btf wcar mcr afi pe bvb wim bc ss cte nsn gd watic aa bfmv fob f8230,neutral
bitch you not coming,offensive
text me with plans nigs,offensive
this hoe 128293128293,offensive
they call me chief weak bitch,offensive
lets cripple the vanity industry how actually start liking who we are and how we look,neutral
pretty ass niggah,offensive
hennessey venom gt 128584 thats one sexy bitch,offensive
8220 bitch gotta work all hard to clean that shit without ripping her skin8221 lmaosjdusubejs,offensive
dropped a stack cause bitch im on song called dope download the mixtape here,offensive
i wasnt calling you a faggot but you are one lol,hate_speech
fag,hate_speech
call me a fag but i love when people turn their heads or look out of their cars when i drive by cause they head me slumpin bitches love it,offensive
fuck a closed casket bitch put me with the trees let me rot throw some seeds water me and give me leaves,offensive
that was my faggot rant for the night,hate_speech
defiantly going to see that new planet of the apes tonight,neutral
lassen cc the coach wants me i feel it youll get more my nig no doubt,hate_speech
i just wanna slit this mf throat,hate_speech
no comparison the beatles are a bunch of cunts but the band that matters the most is the faces imo stones second,offensive
you cant be ugly and a shitty fucking person pick a struggle bitch,offensive
good mernin faggots,hate_speech
8220 early bird gets the dick1277708221 128514128514128514,offensive
im so high high high that a bitch cant blow my high,offensive
i been fucked that hoe she a nobody,offensive
8220 when you live this gay you cant be afraid of two black dicks in your butt you fucking queer,hate_speech
128514 rt lmfao rt if you watching porn amp beating off amp yo homie text u amp it show his name in the banner youre a faggot,hate_speech
live lol whats wrong with these bitches man,offensive
like a flat tire he need a fix 8220 run up on em put the gun up on em ask a pussy nigga whats to ya bitch 8221,offensive
weazy bitch birdman jr,offensive
back in the g getting pregnant was a big deal now these bitches getting pregnant amp its like what else new,offensive
im xxx triple x rated bitch,offensive
heres how your suggestion plays out racist ha those niggers stopped callin each other nigga the end,hate_speech
the nations know who we are but we rather be real niggers amp bad bitches,hate_speech
niggas talk more than bitches these days,offensive
my nigga really tried to save his bitch lol,offensive
nigga wanna bitch about a party yall know my address knock at my door,hate_speech
lmao you stupid nigger,hate_speech
basic bitches amp lame niggas lt,offensive
you hoes steady coming for me 128514128514128514,offensive
hit the strip club and see some bitches i went to school with,offensive
its just not the same littledebbie cloud cake are not twinkies,neutral
you just caught this bitch cheatin while you at work shes with some dude tryin to get off fuck slittin her throat cut this bitchs head off,offensive
ate pussy for the first time today all i have to say is i think i may have a new favorite food michigan,offensive
