text,label
jig levitating rt samsung made fun of bendgate now the galaxy note 4 fails too,neutral
yall folks basic ya parents both racist im lawyering these hoes out here beatin cases,offensive
stop gassing up these regular ass bitches,offensive
every spic cop in losangeles has raped or has thought about raping a white woman thats why those halfbreeds get jobs as pigs,hate_speech
everybody tryna fuck the next nigga bitch not knowin that his bitch is the next nigga bitch 128586128566,hate_speech
yes good shapely eurotrash manbooty,offensive
shut up chink,hate_speech
reaaallly wish i had more milk for oreos lol,neutral
im glad you hoes aint my momma,offensive
yeah lil nigga i was homecoming king and still been getting bad bitches as u see 999665039,offensive
and if you aint a hoe get up out my traphouseeee,offensive
the heat will make you wanna put hands on a niggah 128166127386128544128072,offensive
ha dat bitch in jail,offensive
because shes a nigger,hate_speech
boys still got birds in the cage lol,neutral
every gook in losangeles should be deported or killed,hate_speech
yes im white washed because i dont go around repping my hood and saying a bunch of ignorant nig terms,hate_speech
our people now is the time for the aryan race 2 stand up and say no more before the mongerls turn the world into a ghetto slum 1488,hate_speech
with your bitch ass,offensive
here let me say it more clearly since your retarded ass dont understand,hate_speech
8220 girl you eat mo pussy than me girl you shoulda been a nigga8221 thats that jam,offensive
good morning charlie,neutral
no you ignorant cement headed hillbilly you said taxing cant you fuckin read you fucking knob gobbling douchebag,hate_speech
im starting to not like meek this nig a lil to arrogant for me,hate_speech
how you real dont put no money on you nigga books but chu buy a bitch chanel just to hit the puss,hate_speech
this girl comes into class with fried chicken and pulls hot sauce out of her purse i mean come on how ghetto amp stereotypi8230,hate_speech
like a slow death 8220 how does it feel to have a shit load of nudes to fap to but not one bitch to fuck8221,offensive
will you mention why being called nigger is wrongwitch i agree with amp bossy is wrongbut being called a pimp is still ok,hate_speech
man who da fuck let this hoe in the background looking like a got damn zebra betawards,offensive
claim whatever part of her u please fuck her to bliss or bruise her sweet pussy with a crop till she begs to be your filthy 8230,offensive
sharpton went from being a big fat snitch to a skinny bitch either way hes nothing but a carni8230,offensive
that awkward moment when you hold the door for someone and they use the door next to it like bitch you better back th,offensive
but bitches catch feelings after all the damn time,offensive
people who play roleplayinggames are human filth and dont deserve the same respect youd give a mosquito theyre soulless gutter trash,hate_speech
i missing something of my ofay friends day all scared by da recent happenings dont chu worryol lamar say you like da colored folk,hate_speech
side bitch sunday 128514128514128514 128514128514128514,offensive
8220 i saw a girl scratch her private today what that mean8221 dont fuck her right in the pussy,offensive
i just might buy myself an arod jersey newyork yankees mlb,neutral
not all straight men i am frustrated unlike on okcupid queer folks don8217t have the ability to block,hate_speech
do your dick hang low do it wobble to and fro can you tie it in a knot can you stick it in a hoe,offensive
i remember 2 of my friends had this and i was jelly rt had this bitch you couldnt tell me shit bruh,offensive
youre a fucking pussy and no this isnt a joke you girly little bitch,offensive
niggas madd gay rt teachers giving niggas pussy and they snitching incredible,offensive
when the yanks and sox get together things usually go smoothly gt,neutral
is he chunky,neutral
these blacc ass charcoal bitches be sayin they mixed with irish and some other false shit cuh,offensive
i need their workout plan 128525128553 third bitch had a fucking miracle,offensive
egypt r the muzzie bros still running things only a tad better certainly no respectors of dem though,neutral
mi caldito de pollo estuvo incredible ahora a snuggle con mi snuggie y mi hubby queeee riiikkooo,neutral
im just a young niggah tryna live my life long,offensive
school doesnt even test your intelligence it tests ur memory it tests my ability to keep calm and not slap a bitch,offensive
lol we gotta let these hoes know pow pow this aint what they want gtgt,offensive
stay talking defending your fuckboy ass boyfriend or what go suck him off while youre at it faggot,hate_speech
gay ass nigga 128514128514 bitch you thought you thought,hate_speech
fat dykes make me want to vomit,hate_speech
good morning coons,hate_speech
how the fuck do all these fucking faggot ass randos even find zoes ask account,hate_speech
stay witcha nasty little hoes who dont do shit for you,offensive
idk you into mouthy spics on welfare with 6 kids and 3 baby daddys,hate_speech
oh woulda coulda shoulda ass niggas bitch ass nigga what u bout oh ban wagging ass nigga catch your phase,hate_speech
i think i did my job here toodles to you bitches 999665039,offensive
it stinks in here must be then pussy ass niggas talkin shit tomyfacebro test me,hate_speech
when hoes feel like their photo didnt get enough favorites,offensive
you the whitest person on my tl but you always so ghetto im sick of it,hate_speech
niggas probably be watching me like look at this uncle tom ass rasta,hate_speech
youre a fucking nigger,hate_speech
wat type of bitch ass nigga rape a innocent female,offensive
that bitch gonna get a rug burn,offensive
my cats a bitch niggah,offensive
you fucking fag 8220 this is exactly what i am talking about women are pigs,hate_speech
them old bytches sorry as phuck in the sack 171 the pussy get ripe in her 30s187,offensive
k dude seriously im not retarded so stop talking to me like i am or ill start being retarded and make you change my drool cup,offensive
ohioans clowned on kid like its sooo warm here what the fuck is wrong with minnesota well that bitch karma teamed wit8230,offensive
yas bitches,offensive
i know righttt rt i hate fat loud bitches,hate_speech
i just wanna get filthy rich amp have a nice big house full of bad bitches that i could fuck anytime i want 128540,offensive
i ont like that game wit that retarded ass bird 128530,offensive
fugly queer white trash,hate_speech
crazy girlfriends usually love you longer amp got the best pussy,offensive
not fun when you have braxton hicks and cramps regularly from moving around you try it,neutral
how u gone bring ur side bitch to a game where you know ya gf friends at 128553128553128553128553 i swear,offensive
bitches on me bout da lil flexin shit on snapchat 128176128176128176128176128176128514 bitch please,offensive
8220 well he is at genos so he is the ultimate faggot8221 got to show this queer how to eat 8230,hate_speech
lol my bad i forgot that hoe made ya sad,offensive
before covering up irs misdeeds creepy little leprechaun john koskinen cooked the books for teamsters amp freddie mac,offensive
why people think gay marriage is okay is beyond me sorry i dont want my future son seeing 2 fags walking down the street holding hands an,hate_speech
wow rt whatever fuck all those assholes theyre niggers they all look alike to me,hate_speech
new sign up at mong kok protest site says fight for democracy and oppose the communists to have a future,neutral
im obviously not talking about cod because that game is for queers,hate_speech
lrg ass nigguh,hate_speech
i told that bitch idgaf about a benz bitch,offensive
how the fuck do all these fucking faggot ass randos even find zoes ask account,hate_speech
homeee fag,offensive
tylers my bitch sorry but i own you,offensive
you gotta be able to keep a bitch on her feet or shell be on her knees with the next nigga,offensive
johnny rebel if i could be a nigger for a day,hate_speech
i got 05 of rain yesterday including the bird shit in my gauge,offensive
dp double penetration aka a dick in the ass and a dick in the pussy at the same damn time,offensive
first game first play dat can fuck my bitch,offensive
bitch mind your business,offensive
so basically you like the background music fag,hate_speech
beyonc233 is trash,hate_speech
new orleans is still trash,neutral
shut yo cracker jack buck teeth ass am a native and a nigga the best kind,offensive
i could say my name butttttttt ya bitch already knows it 127926,offensive
bruh we can finally roll like rednecks drug dealers,hate_speech
tell the hating niggah stfu,hate_speech
i never had any friends the entire time i lived in virginia no one was cool to me i hope those white trash southerners all die,hate_speech
fag,hate_speech
hey dont be like a stupid white bitch in some horror movie asks america to hide from isis behind some chainsaws mkay,hate_speech
128514 rt lmfao rt if you watching porn amp beating off amp yo homie text u amp it show his name in the banner youre a faggot,hate_speech
take me for a ride 128525128139 woof woof,neutral
cock slappin bitches since 95,offensive
you gots da bet and da msnbc wit dat colored reverend who only listen to coloreds what else i missing,hate_speech
your a fag,hate_speech
lets play what will the ghetto white girl with neck tattoos in front of me buy if you answered cigarillosyouve seen this episode b4,neutral
gayer then 2 faggots in bed together128129,hate_speech
so ur faggot teammate hits someone late like that and u say hes yapping and yelling u guys def 69 in the room,hate_speech
shoot that nigga an his shorty bitch,hate_speech
ya bitches luv throwing bread crumbs on the ground and complain about the pigeons who come flocking towards ya,offensive
lmaoo we was sayin this same statement last year rt boozer is trash bro im done 128514,neutral
shut up bitch nigga,offensive
lookin good mick,neutral
vinitahegwood can get a job at the naacp or as the ag i hear they like diversity and tolerance as long as you aint a cracker tcot,hate_speech
you think america has crooked lawswomen in other countries get executed in the street for shoningyou american hoes wouldnt make it,offensive
i hate when people just randomly stop talking to you like give me a reason bitch,offensive
hahaha these niggas funny ask128128128128128128rt8220 i bet i can pull at lease 3 bitches with them 1285141285148221,offensive
your so fucking retared its not even funny bitch im going to sleep u,hate_speech
kick dem fucc niccas out da spot,hate_speech
are you working on route running and catching youll be a good wr for grier have fun with the white trash racist uf fans fsu,hate_speech
yeah kaepernick might have biceps like a greek god but the dude looks like he was conceived by a proboscis monkey,neutral
congressmans office admits hell yeah benihana up in this bitch tweet was a mistake,offensive
no its wrong to try to change faggotsgt there is no therapy so tcot should understand and sympathize like they are retardsgt,hate_speech
ya i know all the slang im racist i h8 porch monkies,hate_speech
128514128514128514128514128557128557128557128557rt mexican bitches shaped like silly puddy,offensive
my dick is called offensive joke because some bitches get hurt when it goes too far,offensive
fredo was a bitch ass nigga how niggas fire over 20 shots at his pops but he didnt get off 1 cuz he dropped the gun smh,hate_speech
oops constitutionalists teabaggers in mississippi forgot ratify a centerpiece of the constitution 13th amendment banning slavery,neutral
its funny how these hoes will be texting yo phone all day and then 3 days later have a boyfriend 128514,offensive
fuck off bitch,offensive
stfu faggot a clip is 4 holy fucking tittyy shit,hate_speech
tjohngang128520 lil bitch follow me,offensive
cue the liberal lefts uncle tom attacks against tim scott in 432 tcot teaparty gop,neutral
scarlett johansson,offensive
bet you wont em doe 8220 hoes gon be hoes shut up you a hoe1285141285141280648221,offensive
lol nigga just walk in that hoe looking for girls dont even wanna buy nothing,offensive
gerryshalloweenparty halloween was yesterday stupid nigger,hate_speech
guess whos a little bitch,offensive
you like them bitch niggas,hate_speech
dead1281288220 128553 rt when ur fuckin and her pussy stank but u have really good friends ht8230,hate_speech
comes home late bae was her pussy good me whos 128517 bae oh never mind,offensive
one mans trash is another mans wife,neutral
youre a fucking ugly bitch i wanna stab you to death and then play around with your blood patrick bateman,hate_speech
camels ostriches and zebras see you at the races vccamelraces,neutral
ill be that lmao 128513128513128513rt pussy,offensive
i swear you straight up bitch,offensive
then i hit that bitch like a free throw,offensive
lakers fans will feel the pain the yankees fans are feeling today at the end of basketball season,neutral
shouldve caught it the first time nigger,offensive
them brownies tho 128524128076,neutral
thanks carolina fans 4 the flipped birdsfew bottles to the head sticks n stones may break my bones but aluminum zimas will 8230,neutral
weird to see a local yokel journalist get worked up enough to take such a pointed side though thought they were impartial,neutral
show your support during fleetweeknyc with troopthanks you could be on the billboard in times sq,neutral
and dont come to my mf house honking ur damn horn get tf out the car amp ring my bell bitch,offensive
fuck brett farve redneck ass he stuckup he dont give a damn lol he be on campus acting like he the shit,hate_speech
takin it straight to dirt why finger the pussy when i know i can put my dick in it,offensive
doing someone wrong for the sole reason that they did you wrong will only bring more negative karma amp energy into your li8230,neutral
these niggas retarded lmfaoo,hate_speech
that bitch lebron counted to like 6 he ain8217t eem give miami 6 yrs 128514128514128514,offensive
hits blunt if a guy talk to 5 girls is he a hoe or does he have hoes,offensive
smh iont understand it but fuck it more hoes for me 128527128514,offensive
you can no longer run a business n america unless its deemed acceptable by 1 political group of retards known as democr8230,hate_speech
youre white arent you rolls eyes rt rip to my nigga trayvon a worthless spear chucker,hate_speech
my homeboy got a hoe number on house arrest i said thats good she wont ask to go anywhere,offensive
oh woulda coulda shoulda ass niggas bitch ass nigga what u bout oh ban wagging ass nigga catch your phase,hate_speech
you say no to ratchet pussy but juicyj cant bands will make her dance,offensive
bitch didnt we just discuss this shit yesterday what time faget,offensive
8220 cowboys win games during the regular season but when they get to the playoffs that trash af lol8221 hating ass nigga,hate_speech
hurt ass how ah whole nigga hate on a bitch tf,offensive
you cant call someone a fag if youre snuggling up with guys,offensive
why is such a bitch i mean who gets mild salsa his father should be ashamed,offensive
your so fucking ignorant u talk a lot shit for someone who dont wanna fight your mama raised u as bitch huh,offensive
yeah you right and you know them mexicans bringing all they family that hoe finna be packed,hate_speech
dont watch me you beta watch your bitch nigga,hate_speech
yo if you get like over 25 of flappy bird you need to do some self evaluation because you probably have no life,neutral
happy birthday i love you faggot,offensive
all i want is bitches big booty bitches,offensive
bitch,offensive
liberty and justice for all rt go get me a sandwich nigger or ill kill you,hate_speech
slow replies make me feel like a retard and i just want to put my foot through a wall hjhdyhdhlgjdftilh,hate_speech
if you open a beer and dont finish it you are what is known as a little bitch,offensive
that nigger music,hate_speech
8220 this dude a fucking legend bruh fuck her right in the pussy lmao true legendfuck her right in the pussy,offensive
havent you ever heard the story of the birds and the bees,neutral
that bitch called on thor for some strength 5838658386 rt wait,offensive
quit bitching faggot happy you cant see your faggot family cry baby little girl crying in the parking lot you aint a man sissy,hate_speech
these bitches play on everybodys team,offensive
kicking niccas tf outcha mentions like,offensive
aye we all needa keep are heads up high who cares if we lost we all went and tried our best ampsouth is a bunch of trash talking pussys,offensive
big bitches be like 8221 im thick8221 yea bitch atound the midsection,offensive
brandon phelps a hoe ass nigga and wen i see him ima smack him like da lil bitch he is 300,hate_speech
walk out that bitch like rt just murdered that test,offensive
i dont care tho cracker,hate_speech
they might be called 5 seconds of summer but their songs are 3 minutes of trash,neutral
that bitch is hella cranky today someone hand her a joint,offensive
gracias por jugar con el corazon ahora a ganarle a los yankees,neutral
wish i coulda said more to tonight good seeing you fag 128540,hate_speech
bdubs is packed with beaners 128557128514,hate_speech
lol its gonna be so fun got two niglets on the way,offensive
8220 why yall think its ok to be faggots8221 and want us to be cool with them,hate_speech
i dont fuck with bitch niggas i only fuck niggas bitches128556,hate_speech
yasss bitch you did it,offensive
man most of you coons couldnt jus up in quit yo job if you found out ya boss racist so shut tha fucc up niggas love 8230,hate_speech
illegal alien is not a race its a crime wetbacks,hate_speech
does sza have freckles on her pussy too,offensive
i stopped caring about mcm when i noticed dykes where getting chose before me,hate_speech
not just cause of hoes go to jail cause of fucking up hoes bloody n making them call you head honcho,hate_speech
this is true that bitch has two accounts,offensive
theyre working on a bill to prevent retards from voting who knew retards could vote things are starting to make sense now,hate_speech
bitch for who gap rt im a model yall bitches cant tell me nothin,offensive
no boats and hoes please thanks mom,offensive
id rather be at school improving my life than sleeping at home im back bitch,offensive
your whats wrong with the white race you fuckin coon slaying piece of poop please die alone,hate_speech
if youre being a little scared bitch about the possibility of a louisville purgejust go to ferguson,offensive
youre reading you coon,hate_speech
this weeks rfn segment is in the can i discuss idaho being a faggot marriage state just like washington,hate_speech
the easiest way to have sex with a chick is to smell good make her laugh take her to get food and then fuck her right in the pussy,offensive
bitches be fallin so inlove w niggass amp then he go get a new bitch amp they try go get a new nigga to try to forget about the 8230,hate_speech
bruh im tired of niggas retweetin miley cyrus naked that bitch aint no types of bad lmaooo,offensive
wallah i fucking hate this fuckin mexican bitch so much,offensive
tia chepa uhh noo bitch she is your tia irma 128530 aghh hes so annoying,offensive
it8217s the entire pats bandwagon they8217re faggots,hate_speech
i prefer jameis winston to not speak on tv at all damn coon,hate_speech
honestyhour we dont love these hoes,offensive
thank you oneaday for making your vitamins the size of a fucking twinkie i love giving myself the heimlich maneuver every mo8230,offensive
so many hoes whipped you would have thought we were still in slavery,hate_speech
watch out for these foul hoes and flagrant niggas,offensive
look at all those fake ass fuck boy ass desperate for a ring ass trash ass fake ass fans out there,offensive
drakes new shoes that will be released by nikejordan yes theres glitter on the shoes dudes a fag,hate_speech
i say fuck them other niggas bitch im all you need 128074,offensive
128514benzino bitch wasnt ready 128557128557127821,offensive
black girls have never been into me i guess cause i dont call them hoes sell drugs or shoot niggas o well,hate_speech
sounds like the hysteria over bird flu a few years back it had a lower mortality rate than the regular flu,neutral
females be 14 acting 18 128684128138 turning up like they 21 127867127864 throwing the pussy like they 25 128049128166 but still cant pass alg8230,offensive
young attractive successful supportive faithful man w his own everythingu think bringing solely pussy to the table is 8230,offensive
mitt romney gone take away weave if he become president hoes gone be walkin around looking like lil bill amp calliou,offensive
pudding it right in her pussy,offensive
brady heard yall say he was washed now he washing the league on you hoe ass niggas,hate_speech
im a knock the pussy out like fight night,offensive
these niggas run they mouth like bitches,offensive
hoe dont make me put up screenshots of your texts to me hoe,hate_speech
gave her that move it lil nigger push smh,hate_speech
i cant trust a bitch i cant trust myself,offensive
shawty said you not gone understand america unless you went to a pwi school crackers already brainwashed her smh lol,hate_speech
aint no broke bitches standing next to me128564128564,offensive
8220 i hate that hoe already 128514128128 128514128514128514 this shit cracks me up,hate_speech
8220 aint that a bitch8221,offensive
them shootas is out by my grandmoma house i aint been round this bitch in a minute,offensive
young buck wanna eat dat nigguh like i aint fuckin dis up again,offensive
hate when hoes try to lead u on naw like lil bitch im coool,offensive
shut up bitch,offensive
2 iubb games when im in bloomington btown how good is that ncaa basketball college indiana iu hoosiers,neutral
lol naw that bitch was just a sociopath,offensive
faggot ass bitch nigga,hate_speech
i hate when bitches twerk to slow songs 128530128074128162,offensive
only white trash watch football,hate_speech
or the teach might get u got rt i really hate a disrespectful ass bitch in class the professor is talking you stfu bitch,hate_speech
i rather my girl be clingy than a hoe,offensive
i cant bitch,offensive
i just wanna slit this mf throat,hate_speech
youre cheating on mickey bubbles o,neutral
she must not know i got over 3000 followers breh this bitch gotta get the fuck up outta this vip section dawg she decreasing my value,offensive
you always see some shit on old york rd on the late night i done seen like 4 tranny and a midget,offensive
happy birthday my little cotton picker,hate_speech
hey im still on lambdamoo and it really is empty nobody to talk to except that asshole bird,offensive
if a guy ever called me names such as bitch slut blah blah id never ever think twice about being with him like fuck you i8230,offensive
missouri got them swag fags lmao,offensive
yo bitch on my dick she come to my crib she get passed around no love,hate_speech
this nothing to do with my shoes you ignorant twat,offensive
8220 esj got some ugly hoes yeah and them leon g students aint making no better 999 of em fugly8221128128128128,offensive
here let me say it more clearly since your retarded ass dont understand,hate_speech
8220 fuck all the heat bandwagon riders we know who you are8221 u sound like the hoes mad they man cheated with a fat booty bitch,offensive
1st game of fall 7s finna kill some hoes,offensive
people are fucking retarded lol,hate_speech
i knew you were a faggot though,hate_speech
mila kunis has heterochromia iridum which gives her two different colored eyes one eye is green the other is brown,neutral
whatever no matter how many times kids fuck me over i will never become i pussy i promise you that,offensive
when someone is murdered the police investigate the spouse first and that tells you everything you need to know abo8230,neutral
cuz bitches love cheesy,offensive
niggah niggah niggah dont believe me just wacthh,hate_speech
fuck mlk 8220 8220 why does lexii keep favoriting my coon tweets 8221 mlk didnt die for this8221,hate_speech
i promise the last thing you wanna do is be a bitch to my sister in front of me dont poke the lion,offensive
her pussy stay wet when shes around me gotta lick it till she wetter then never before,offensive
quitting showed me who my true friends were and it showed me all the ones who were the two faced bitches,offensive
apaches 30 mm rounds turn jihadis into tomato soup,hate_speech
happy birthday freshman faggots,hate_speech
lay in it brother im a honky,offensive
im such a bitch sometimes128553128553,offensive
low blow cuntface how many times the yanks beat us in the playoffs these last 8 or so years,offensive
light beer you mean faggot piss overly powered man,hate_speech
means trash lol,neutral
older black guy at factory i know none of these coons i work with tipped so heres 15 he was right too 128514128514128514,offensive
open her legs then filet mignon that pussy,offensive
dont raise ur hand to me niggah,offensive
shelby your pussy is beat up,offensive
128514128514128514 a box full of yellow crayons,neutral
3 most common white people activities 1 wearing tapout 2 shooting up schools 3 calling you a nigger on xbox,hate_speech
no bitch i dont have anything to hide i just dont like people looking through my phone,offensive
only one problem theres a no pussies allowed sorry,hate_speech
happy birthday my little cotton picker,hate_speech
8220 find a loyal ho8221 128521,offensive
13hours of hell obama flat out lied to get reelected killery ltwhat diff does it make now karma its a bitch,offensive
hey bitches ill be in ic tonight so dial the digits 128527,offensive
1 2 3 4 how many niggers are in my store i knooooooow your stealing 128514128514128514,hate_speech
one less little nigger that would grow up into a big nigger,hate_speech
here let me say it more clearly since your retarded ass dont understand,hate_speech
